College_ID,College_Name,University_Name,State,City,College_Type,Establishment_Year,NAAC_Grade,NIRF_Rank,Total_Students,Total_Faculty,Student_Faculty_Ratio,UG_Courses,PG_Courses,Placement_Percentage,Average_Package_LPA,Highest_Package_LPA,Internship_Percentage,Research_Publications,Annual_Fees_INR,Graduation_Rate,Academic_Year
CLG01334,Jain College of Engineering and Technology,Manipal Academy of Higher Education,Odisha,Bhubaneswar,Deemed,2014,B,442.0,3355,334.0,10.04,"B.Pharm, BCA, BA, LLB, B.Sc",M.Pharm,100.0,6.6,11.01,76.8,20.0,256389.0,71.6,2022-23
CLG01678,KIIT Institute of Pharmacy,Manipal Academy of Higher Education,Assam,Silchar,Private,1973,B++,358.0,3490,202.0,17.28,"B.Com, B.Arch, B.Tech, B.Sc, B.Pharm","LLM, M.Tech",100.0,12.98,17.27,63.5,35.0,461561.0,93.3,2022-23
CLG00305,KIIT Institute of Higher Education,Chandigarh University,West Bengal,Durgapur,Government,1989,B,159.0,4202,209.0,20.11,"B.Arch, B.Sc, BA","M.Pharm, MBA",79.4,5.14,15.15,58.8,9.0,76044.0,94.7,2022-23
CLG01386,Netaji Subhas Institute of Engineering and Technology,Calcutta University,Puducherry,Puducherry,Private,1951,A,167.0,6500,373.0,17.43,"B.Pharm, BCA, BBA",Not Available,79.3,6.3,21.82,38.3,49.0,99133.0,70.4,2024-25
CLG01724,"KIIT College of Arts, Science and Commerce",Amity University,Bihar,Gaya,Private,1958,B,51.0,4654,455.0,10.23,BA,Not Available,61.5,6.47,10.16,54.2,23.0,10000.0,82.2,2023-24
CLG00075,Miranda House Polytechnic Institute,Ranchi University,Maharashtra,Mumbai,Private,1986,A+,440.0,4582,186.0,24.63,LLB,"LLM, M.Tech, MA, MBA",49.7,6.13,16.66,60.2,38.0,212517.0,82.8,2024-25
CLG01146,DAV Institute of Management Studies,Ranchi University,Karnataka,Mysuru,Private,2015,B,203.0,3378,191.0,17.69,"BCA, BA",Not Available,38.6,6.29,13.19,68.3,2.0,44897.0,91.4,2024-25
CLG00523,Indian Institute of Technology Kharagpur,SRM Institute of Science and Technology,Haryana,Kurukshetra,Deemed,2017,B+,119.0,3901,204.0,19.12,"B.Arch, B.Sc",M.Sc,55.2,6.14,23.26,39.6,14.0,216911.0,85.1,2022-23
CLG00336,National Institute of Technology Bhopal,Gujarat Technological University,Delhi,Delhi,Private,1989,C,47.0,200,12.0,16.67,"B.Sc, LLB","MA, M.Sc, M.Arch, M.Pharm",74.5,4.75,9.75,74.1,9.0,134563.0,59.0,2023-24
CLG00570,National Institute of Technology Silchar,Aligarh Muslim University,Uttarakhand,Haldwani,Autonomous,2017,B++,13.0,2152,216.0,9.96,"B.Arch, B.Com, B.Pharm",MCA,74.7,7.43,13.78,21.0,11.0,150688.0,84.5,2023-24
CLG00591,National Institute of Technology Jamshedpur,VIT University,Andhra Pradesh,Tirupati,Private,2004,B++,460.0,5335,551.0,9.68,"BBA, LLB, B.Sc","M.Com, MA",66.4,6.52,8.74,55.2,31.0,382805.0,97.4,2023-24
CLG00089,Bishop Cotton Institute of Pharmacy,Banaras Hindu University,Tamil Nadu,Madurai,Private,2001,B,456.0,3623,149.0,24.32,"B.Com, B.Pharm, BCA","MBA, M.Sc, MCA, MA",89.2,6.14,24.05,56.1,16.0,395338.0,69.5,2022-23
CLG00875,Ramaiah Government Polytechnic College,Ranchi University,Goa,Panaji,Government,1977,A,47.0,1021,118.0,8.65,B.Arch,"M.Pharm, MA",87.4,9.22,19.49,56.3,71.0,125571.0,63.3,2022-23
CLG00810,National Institute of Technology Silchar,Bangalore University,Chhattisgarh,Raipur,Government,1968,A,380.0,3976,199.0,19.98,BCA,Not Available,47.6,10.74,16.65,64.0,20.0,35770.0,75.3,2022-23
CLG01057,Symbiosis Institute of Applied Sciences,VIT University,West Bengal,Kolkata,Autonomous,1960,B++,279.0,3685,236.0,15.61,"BBA, BCA, B.Sc, B.Arch, B.Com",Not Available,75.6,10.35,14.82,62.3,35.0,207339.0,55.3,2024-25
CLG00218,BITS Institute of Engineering and Technology,Punjab Technical University,Rajasthan,Jodhpur,Government,1957,B,149.0,5005,436.0,11.48,"B.Tech, BCA, B.Arch, BA, LLB","MA, M.Arch, M.Sc, MBA",100.0,4.56,13.37,55.2,37.0,74290.0,86.1,2024-25
CLG00889,Kirori Mal College of Engineering,Gujarat Technological University,Karnataka,Bengaluru,Government,1956,Not Accredited,441.0,4143,282.0,14.69,"B.Sc, B.Tech, B.Com, BCA, B.Arch",LLM,83.9,16.51,30.43,53.7,32.0,42218.0,77.8,2023-24
CLG01390,Thapar School of Business Management,Rajasthan Technical University,Gujarat,Surat,Government,2015,A++,14.0,2459,194.0,12.68,"B.Com, BBA, B.Tech, BCA",M.Arch,62.0,6.81,32.8125,91.0,2.0,61764.0,92.6,2024-25
CLG00713,National Institute of Technology Silchar,Lovely Professional University,Gujarat,Vadodara,Government,1953,A,453.0,2726,170.0,16.04,"B.Arch, B.Tech","LLM, M.Com, M.Sc, M.Tech",53.3,3.84,8.52,74.5,0.0,38912.0,89.3,2022-23
CLG01262,National Institute of Technology Srinagar,Rajasthan Technical University,Tamil Nadu,Madurai,Autonomous,2022,B++,253.0,1992,162.0,12.3,"BBA, B.Arch, BA",M.Com,75.9,9.25,12.14,53.1,12.0,31830.0,77.8,2022-23
CLG00857,National Institute of Technology Raipur,JNTU Hyderabad,Odisha,Rourkela,Private,1993,C,403.0,2785,212.0,13.14,LLB,"MA, M.Com, M.Sc",81.0,7.48,13.97,59.2,12.0,268301.0,68.1,2024-25
CLG00174,Indian Institute of Technology Gandhinagar,Mahatma Gandhi University,West Bengal,Kolkata,Government,1980,A,415.0,4403,212.0,20.77,BA,"MCA, M.Com, M.Sc",57.2,6.16,14.48,97.5,63.0,51245.0,61.2,2022-23
CLG01690,Hansraj Institute of Management Studies,SRM Institute of Science and Technology,Jammu And Kashmir,Srinagar,Deemed,1978,A+,490.0,5198,502.0,10.35,"BCA, BA, B.Sc, B.Pharm","M.Sc, MBA",33.9,6.39,16.04,89.2,46.0,124732.0,69.2,2024-25
CLG01269,Manipal National Institute of Technology,VTU,Andhra Pradesh,Vijayawada,Deemed,1953,B+,246.0,200,10.0,20.0,"B.Sc, BBA, B.Pharm, B.Arch","LLM, M.Tech, MCA, M.Com",62.8,2.6,12.27,38.7,5.0,223465.0,74.5,2023-24
CLG00222,KIIT Institute of Management and Research,Sharda University,Karnataka,Mangaluru,Government,1988,B,167.0,6472,457.0,14.16,"LLB, B.Pharm",Not Available,98.2,4.5,18.5,89.7,42.0,62659.0,82.4,2022-23
CLG00320,Indian Institute of Technology Indore,Guwahati University,Rajasthan,Guwahati,Private,1961,A,320.0,4175,202.0,20.67,LLB,"M.Tech, MCA",62.2,7.09,12.84,100.0,28.0,298603.0,61.4,2024-25
CLG01603,KIIT Institute of Higher Education,University of Mumbai,Punjab,Amritsar,Autonomous,1965,A+,429.0,1540,132.0,11.67,"B.Pharm, B.Sc, B.Com, BBA, LLB","MCA, M.Pharm, M.Com",75.6,11.64,25.79,83.3,116.0,63057.0,73.7,2024-25
CLG01626,Kirori Mal College of Engineering and Technology,Lovely Professional University,Tamil Nadu,Madurai,Private,1986,B+,102.0,2166,144.0,15.04,BBA,"M.Tech, M.Arch",60.7,6.89,12.79,82.3,31.0,254638.0,64.1,2023-24
CLG00879,Indian Institute of Technology Roorkee,Dr. APJ Abdul Kalam Technical University,Kerala,Kochi,Government,1954,B+,348.0,5182,232.0,22.34,"B.Sc, LLB, B.Arch, B.Pharm",M.Arch,74.1,6.62,15.77,61.2,20.0,57409.0,64.6,2022-23
CLG01689,Dr. Ambedkar Law College,University of Mumbai,Jammu And Kashmir,Srinagar,Private,1953,B+,247.0,2510,153.0,16.41,"BA, B.Arch, BBA, B.Sc, BCA","MCA, MBA, M.Tech, M.Sc",73.2,7.79,19.14,66.4,78.0,361288.0,59.5,2022-23
CLG01075,Indian Institute of Technology Jodhpur,SRM Institute of Science and Technology,Rajasthan,Udaipur,Government,2015,B,400.0,5470,306.0,17.88,"B.Com, BA, B.Tech",M.Sc,57.5,14.78,23.24,58.3,50.0,44026.0,87.9,2024-25
CLG00826,National Institute of Technology Allahabad,JNTU Hyderabad,Maharashtra,Nashik,Private,1979,A+,466.0,1389,129.0,10.77,"LLB, B.Tech, B.Com, B.Pharm, BBA","M.Com, MBA, M.Sc",46.6,12.2,24.27,94.4,19.0,246973.0,98.5,2023-24
CLG01747,National Institute of Technology Raipur,Amity University,Chhattisgarh,Raipur,Government,2017,Not Accredited,23.0,6235,357.0,17.46,"B.Sc, B.Arch, BCA, BA, B.Com",MA,71.5,4.95,17.91,48.9,20.0,52205.0,68.1,2022-23
CLG00267,Amrita College of Commerce and Economics,Kurukshetra University,Odisha,Cuttack,Private,1989,A,79.0,4685,250.0,18.74,LLB,"M.Pharm, MBA",76.1,9.31,23.33,43.3,21.0,167458.0,54.3,2022-23
CLG00007,Hindu Institute of Pharmacy,Bangalore University,Rajasthan,Kota,Government,1950,Not Accredited,446.0,5046,249.0,20.27,"B.Com, B.Sc, B.Arch, BCA, LLB","MA, M.Com, M.Pharm, M.Sc",86.8,5.42,11.61,55.4,11.0,54430.0,94.2,2024-25
CLG01237,Indian Institute of Technology Indore,Aligarh Muslim University,Goa,Panaji,Autonomous,1988,A+,100.0,5388,267.0,20.18,"BCA, BBA, B.Arch, B.Com",M.Pharm,71.0,5.32,18.82,35.9,44.0,225188.0,83.2,2022-23
CLG01343,DAV Medical College,Utkal University,Rajasthan,Udaipur,Autonomous,1998,C,54.0,3416,196.0,17.43,"B.Pharm, B.Com",Not Available,66.5,7.12,14.45,63.1,25.0,110914.0,78.6,2024-25
CLG00739,Vivekananda Government Polytechnic College,SRM Institute of Science and Technology,Karnataka,Bengaluru,Autonomous,2023,B,348.0,3088,211.0,14.64,"B.Arch, B.Pharm, B.Sc, B.Com","MCA, M.Com",50.6,7.56,11.95,82.1,144.0,163948.0,85.8,2024-25
CLG00139,"Jain College of Arts, Science and Commerce",Calcutta University,Gujarat,Surat,Deemed,1998,A+,304.0,3838,237.0,16.19,"LLB, B.Arch, BBA, B.Tech","LLM, M.Sc",60.5,8.61,20.64,84.1,10.0,137120.0,64.0,2022-23
CLG00164,Miranda House Institute of Pharmacy,Jadavpur University,Chhattisgarh,Bhilai,Government,1975,A,399.0,3632,275.0,13.21,"BA, B.Pharm, B.Com, BBA, LLB",LLM,96.6,4.83,11.55,63.3,27.0,56347.0,82.3,2022-23
CLG01512,Presidency School of Business Management,University of Mumbai,Chhattisgarh,Raipur,Private,1969,A,187.0,2905,187.0,15.53,"B.Sc, B.Pharm, BCA, B.Arch","MA, M.Sc, LLM",63.2,3.5,5.07,45.9,13.0,146969.0,82.5,2023-24
CLG00595,Vivekananda Institute of Management Studies,Mahatma Gandhi University,Jammu And Kashmir,Srinagar,Private,1989,B,477.0,5251,647.0,8.12,"BA, B.Sc, B.Tech, B.Arch",Not Available,57.0,5.85,7.02,88.7,11.0,404032.0,82.7,2024-25
CLG01733,St. Stephen's Government Polytechnic College,University of Mumbai,Madhya Pradesh,Jabalpur,Autonomous,2018,C,33.0,3516,249.0,14.12,"B.Arch, BBA, BA, BCA, LLB","MCA, M.Arch, MBA",77.6,6.63,17.45,91.0,38.0,192182.0,67.7,2022-23
CLG01540,National Institute of Technology Surathkal,Aligarh Muslim University,Rajasthan,Jaipur,Private,1965,A,412.0,2035,115.0,17.7,BCA,"M.Com, MA, MBA",100.0,6.47,24.64,81.2,4.0,140439.0,72.2,2023-24
CLG01791,Guru Nanak Institute of Technology and Science,Osmania University,Odisha,Bhubaneswar,Private,1977,A++,74.0,4597,223.0,20.61,B.Tech,"MA, M.Arch, MCA",76.2,9.75,14.97,61.7,5.0,381005.0,60.0,2023-24
CLG01745,Vellore Government Polytechnic College,Kurukshetra University,Rajasthan,Udaipur,Government,2014,B,240.0,5037,549.0,9.17,"B.Arch, B.Com","LLM, M.Arch, M.Tech",70.3,10.64,15.91,53.2,111.0,70678.0,100.0,2022-23
CLG00961,Sri Venkateswara Medical College,Aligarh Muslim University,Madhya Pradesh,Indore,Autonomous,1982,B++,52.0,3208,310.0,10.35,"B.Pharm, B.Arch, B.Tech","M.Tech, M.Sc, M.Arch, MBA",82.0,8.06,27.96,65.9,53.0,154733.0,70.6,2022-23
CLG01321,Hindu College of Engineering,Guwahati University,Madhya Pradesh,Jabalpur,Government,2016,A,432.0,3334,134.0,24.88,"B.Tech, B.Arch","MA, M.Sc, M.Com, M.Tech",66.5,12.62,18.38,72.5,13.0,59493.0,67.3,2024-25
CLG01695,Indian Institute of Technology Ropar,Amity University,Telangana,Hyderabad,Private,2012,B++,96.0,1513,84.0,18.01,"B.Tech, BBA, BCA, BA, LLB",Not Available,79.2,11.8,23.74,89.7,1.0,177553.0,100.0,2022-23
CLG00524,BITS Institute of Technology and Science,Ranchi University,Tamil Nadu,Chennai,Autonomous,1993,A,240.0,5002,201.0,24.89,"LLB, B.Com",Not Available,86.0,8.62,29.1,71.1,27.0,142369.0,74.0,2022-23
CLG01145,Kirori Mal Institute of Pharmacy,University of Mumbai,Assam,Silchar,Government,1986,A,448.0,3392,329.0,10.31,"B.Pharm, BA","LLM, M.Pharm",74.4,4.59,10.18,77.4,34.0,17198.0,92.7,2022-23
CLG00807,National Institute of Technology Jamshedpur,Calcutta University,Delhi,Delhi,Deemed,1972,B,20.0,270,20.0,13.5,"BCA, B.Pharm","M.Sc, LLM, M.Pharm",69.4,6.04,8.72,88.8,50.0,253379.0,62.6,2022-23
CLG00745,Kirori Mal Law College,JNTU Hyderabad,Rajasthan,Jodhpur,Government,1975,A,318.0,6063,397.0,15.27,"B.Arch, B.Sc, BA, B.Tech","LLM, M.Pharm",100.0,10.33,16.67,51.6,7.0,17928.0,100.0,2024-25
CLG01119,Manipal College of Engineering and Technology,Bharathiar University,Madhya Pradesh,Gwalior,Government,2006,B+,200.0,5062,311.0,16.28,"B.Tech, B.Pharm, B.Com, BCA, BA","MBA, M.Arch",61.9,7.26,13.96,66.1,6.0,10000.0,80.8,2023-24
CLG00579,Ram Lal Anand Institute of Technology and Science,Sharda University,Telangana,Hyderabad,Government,1971,B,485.0,3233,141.0,22.93,B.Com,Not Available,81.8,10.76,18.32,49.6,7.0,10000.0,64.2,2024-25
CLG00846,Presidency Polytechnic Institute,Rajasthan Technical University,Goa,Panaji,Government,1957,B+,58.0,3094,294.0,10.52,"B.Com, LLB, BCA, B.Tech","MCA, MA",45.0,12.37,32.8125,66.8,37.0,48586.0,97.9,2024-25
CLG01229,Sri Venkateswara College of Commerce and Economics,JNTU Hyderabad,Puducherry,Puducherry,Autonomous,1991,B,361.0,3128,145.0,21.57,"B.Arch, B.Com",Not Available,80.3,5.78,13.82,86.6,37.0,130245.0,76.7,2024-25
CLG00020,Sardar Patel College of Engineering and Technology,Rajasthan Technical University,Andhra Pradesh,Visakhapatnam,Autonomous,1972,C,247.0,3140,284.0,11.06,"B.Arch, BA, B.Com",Not Available,91.8,9.19,15.58,100.0,38.0,66455.0,85.8,2023-24
CLG01195,Indian Institute of Technology Gandhinagar,VIT University,Bihar,Muzaffarpur,Government,1971,B,340.0,3344,146.0,22.9,"B.Com, BA",M.Com,54.5,9.69,17.36,26.2,5.0,25948.0,73.7,2022-23
CLG01029,Indian Institute of Technology BHU Varanasi,Kurukshetra University,Rajasthan,Jaipur,Government,2024,A+,140.0,4410,316.0,13.96,BA,"MBA, M.Sc, M.Tech, LLM",36.8,12.16,20.55,58.1,44.0,66810.0,75.1,2023-24
CLG00634,Indian Institute of Technology Guwahati,VTU,Maharashtra,Nashik,Private,1998,B+,118.0,2425,128.0,18.95,"LLB, B.Com, B.Pharm, B.Sc","M.Pharm, M.Arch, MBA",84.6,9.17,22.32,56.1,29.0,455381.0,63.9,2023-24
CLG01082,KIIT Institute of Management Studies,Mahatma Gandhi University,Maharashtra,Nagpur,Private,1966,B+,242.0,3055,150.0,20.37,"LLB, BBA",Not Available,85.8,1.21,19.05,78.1,48.0,174561.0,72.4,2022-23
CLG00619,National Institute of Technology Surathkal,Rajasthan Technical University,Uttarakhand,Haldwani,Government,1964,B,92.0,3828,194.0,19.73,"BCA, B.Tech, BBA, LLB","MBA, M.Tech",54.8,3.05,14.91,40.0,130.0,52042.0,100.0,2024-25
CLG01351,Indian Institute of Technology Guwahati,Jawaharlal Nehru University,West Bengal,Durgapur,Private,1992,Not Accredited,351.0,3417,142.0,24.06,BCA,M.Com,68.3,8.08,10.83,38.8,53.0,63845.0,83.7,2023-24
CLG00656,Bishop Cotton Government Engineering College,JNTU Hyderabad,Chandigarh,Chandigarh,Deemed,1960,A,20.0,3262,257.0,12.69,"LLB, B.Arch",Not Available,53.5,7.77,10.18,67.9,13.0,269721.0,64.2,2023-24
CLG00017,KIIT Polytechnic Institute,Amity University,Uttarakhand,Haldwani,Private,2020,A,337.0,1644,168.0,9.79,"BBA, B.Sc","M.Com, MBA, LLM, M.Pharm",46.2,9.14,18.46,51.4,5.0,273225.0,82.7,2022-23
CLG01491,Miranda House Medical College,Guwahati University,Uttar Pradesh,Noida,Autonomous,1954,B+,381.0,6248,339.0,18.43,"B.Sc, B.Pharm",MCA,76.2,5.9,11.41,43.4,7.0,10000.0,80.0,2024-25
CLG01071,National Institute of Technology Trichy,SRM Institute of Science and Technology,Punjab,Chandigarh,Government,2022,Not Accredited,44.0,1825,102.0,17.89,"BA, BCA, LLB, BBA",M.Tech,87.8,8.93,15.19,72.7,4.0,23023.0,100.0,2023-24
CLG00138,Presidency Institute of Pharmacy,Chandigarh University,Gujarat,Rajkot,Private,2022,A,277.0,3039,274.0,11.09,"B.Tech, B.Pharm, BCA, B.Sc, BA",Not Available,93.7,4.7,10.86,89.3,22.0,264171.0,71.0,2023-24
CLG01129,Lady Shri Ram Indian Institute of Technology,Visvesvaraya Technological University,Karnataka,Mysuru,Government,1994,A,83.0,1283,64.0,20.05,"B.Tech, LLB, BCA, B.Sc, BA",M.Sc,80.2,6.54,8.23,51.3,60.0,113793.0,70.5,2022-23
CLG00698,Sri Venkateswara Institute of Pharmacy,Ranchi University,Rajasthan,Kota,Private,2003,A++,479.0,3079,207.0,14.87,"BCA, B.Com, BA, B.Pharm",Not Available,44.7,7.2,22.42,58.9,46.0,384609.0,88.4,2024-25
CLG01478,National Institute of Technology Rourkela,University of Delhi,Rajasthan,Jaipur,Government,2008,B++,47.0,5022,255.0,19.69,"B.Sc, BCA","MA, M.Sc, MBA, LLM",88.2,8.03,11.82,69.4,9.0,38315.0,98.6,2024-25
CLG00449,National Institute of Technology Warangal,Mahatma Gandhi University,Goa,Panaji,Private,1977,A,374.0,3537,212.0,16.68,"B.Arch, BA, B.Pharm",Not Available,63.9,4.0,13.49,28.9,15.0,249443.0,94.1,2023-24
CLG00191,BITS National Institute of Technology,Calcutta University,Maharashtra,Nashik,Government,1996,B,138.0,1830,128.0,14.3,"LLB, B.Arch, BCA, B.Tech",MCA,92.0,14.21,22.27,33.0,14.0,125128.0,77.9,2023-24
CLG00328,Shiv Nadar College of Engineering and Technology,Bangalore University,Goa,Panaji,Government,1966,B++,389.0,2746,117.0,23.47,"B.Com, B.Sc, BCA, B.Pharm, LLB",Not Available,64.6,8.33,24.32,67.8,14.0,54424.0,83.7,2024-25
CLG00318,Indian Institute of Technology Kharagpur,Visvesvaraya Technological University,Jammu And Kashmir,Jammu,Autonomous,1967,A+,326.0,4714,217.0,21.72,"B.Arch, B.Com, BA, BBA","M.Arch, MCA, M.Sc",66.1,7.48,17.41,66.9,18.0,195819.0,87.2,2022-23
CLG01396,Ashoka Institute of Applied Sciences,Visvesvaraya Technological University,Karnataka,Bengaluru,Government,1952,A,295.0,5868,308.0,19.05,"B.Sc, B.Arch, LLB, B.Pharm","MBA, M.Pharm, M.Tech",79.1,7.72,17.28,63.4,74.0,10000.0,69.6,2024-25
CLG00527,St. Xavier's College of Commerce and Economics,Guwahati University,Assam,Silchar,Deemed,1983,A,110.0,4380,335.0,13.07,"LLB, B.Sc, B.Pharm","MA, MBA, M.Tech, MCA",66.3,7.74,12.31,50.2,55.0,93231.0,85.9,2022-23
CLG00088,Thapar Institute of Management Studies,Osmania University,Goa,Margao,Government,1975,A++,100.0,5416,234.0,23.15,"BBA, B.Arch, B.Pharm","M.Tech, MA",65.3,7.9,26.18,68.9,29.0,68011.0,90.7,2023-24
CLG01172,Loyola Institute of Higher Education,Jadavpur University,Kerala,Kozhikode,Deemed,1969,C,69.0,2022,102.0,19.82,"B.Pharm, LLB","M.Tech, M.Arch, LLM, MBA",68.0,8.84,13.74,57.8,2.0,99186.0,84.5,2024-25
CLG00149,Shiv Nadar National Institute of Technology,VIT University,Chhattisgarh,Bhilai,Private,1971,A,358.0,6590,507.0,13.0,"BBA, B.Sc, B.Pharm, BA, B.Tech",M.Com,48.5,7.39,14.2,99.2,15.0,397117.0,77.5,2022-23
CLG01485,Shiv Nadar Institute of Applied Sciences,Osmania University,Karnataka,Mysuru,Private,2024,C,25.0,2128,145.0,14.68,"B.Tech, B.Sc",Not Available,54.0,11.01,14.83,60.7,38.0,157544.0,83.3,2023-24
CLG01367,National Institute of Technology Calicut,Banaras Hindu University,Telangana,Warangal,Autonomous,2003,C,334.0,791,212.0,3.73,"LLB, B.Sc, B.Com",Not Available,88.0,6.4,20.81,63.4,20.0,118971.0,65.0,2024-25
CLG00366,Loyola Institute of Applied Sciences,VIT University,Rajasthan,Jodhpur,Government,2006,C,303.0,4365,258.0,16.92,"B.Com, BBA, B.Tech",Not Available,45.8,9.08,12.06,70.9,27.0,64229.0,99.1,2022-23
CLG00590,National Institute of Technology Durgapur,Aligarh Muslim University,Assam,Silchar,Autonomous,2021,A+,247.0,5927,294.0,20.16,"BA, B.Arch",Not Available,78.3,12.15,15.72,57.9,10.0,204459.0,100.0,2023-24
CLG01382,Hindu Polytechnic Institute,Bangalore University,Andhra Pradesh,Vijayawada,Autonomous,1963,B,477.0,2449,200.0,12.24,BCA,"M.Com, LLM, M.Arch",75.8,4.3,18.88,88.8,14.0,191810.0,94.4,2024-25
CLG00199,Manipal Institute of Management Studies,JNTU Hyderabad,Punjab,Patiala,Autonomous,2008,A+,439.0,2382,118.0,20.19,B.Pharm,MCA,39.5,5.85,11.07,66.9,24.0,183285.0,69.6,2024-25
CLG01785,Guru Nanak Medical College,Amity University,Rajasthan,Udaipur,Government,2012,B,274.0,2173,101.0,21.51,"B.Com, B.Arch, LLB, B.Tech",M.Pharm,94.8,8.1,15.22,37.5,36.0,38931.0,100.0,2022-23
CLG00193,Shiv Nadar School of Business Management,Mahatma Gandhi University,Jammu And Kashmir,Srinagar,Government,2002,B+,440.0,398,18.0,22.11,B.Pharm,M.Tech,78.1,4.65,12.75,35.8,0.0,50723.0,71.0,2022-23
CLG00405,Ashoka Institute of Management Studies,Visvesvaraya Technological University,Assam,Silchar,Private,1960,A,221.0,1305,139.0,9.39,"BBA, B.Com, B.Sc, BCA",LLM,86.8,3.26,7.3,75.3,20.0,315497.0,89.7,2023-24
CLG01439,Kirori Mal Medical College,Anna University,Karnataka,Hubballi,Autonomous,1970,B++,203.0,4245,388.0,10.94,"B.Com, B.Arch","LLM, M.Tech, MBA",36.9,4.61,26.17,100.0,40.0,145743.0,88.2,2024-25
CLG00882,National Institute of Technology Srinagar,Mahatma Gandhi University,Uttar Pradesh,Kanpur,Autonomous,2015,C,276.0,200,10.0,20.0,"LLB, B.Sc","M.Sc, MBA, M.Com, M.Arch",100.0,7.83,16.31,44.5,17.0,115581.0,100.0,2024-25
CLG00484,National Institute of Technology Nagpur,Sharda University,Goa,Margao,Government,1971,C,247.0,4055,420.0,9.65,"LLB, B.Arch, BCA, B.Com",M.Com,80.5,7.22,14.59,92.9,8.0,85180.0,97.4,2023-24
CLG01337,Indian Institute of Technology Gandhinagar,Aligarh Muslim University,Himachal Pradesh,Shimla,Autonomous,2012,A,475.0,4047,170.0,23.81,"B.Sc, B.Arch, B.Tech, BA, B.Pharm",M.Com,75.2,10.11,25.54,48.2,28.0,141212.0,78.8,2022-23
CLG00792,Miranda House Indian Institute of Technology,Kurukshetra University,West Bengal,Siliguri,Government,1999,B,232.0,2456,99.0,24.81,"B.Com, B.Pharm, BA, BBA, BCA",M.Sc,73.6,3.9,12.05,80.8,15.0,83286.0,74.2,2024-25
CLG00800,Indian Institute of Technology Madras,Savitribai Phule Pune University,Assam,Guwahati,Private,1982,Not Accredited,247.0,3591,149.0,24.1,"BCA, B.Pharm","LLM, M.Arch",86.6,12.94,32.8125,60.1,15.0,348539.0,61.0,2024-25
CLG00385,Rajiv Gandhi National Institute of Technology,JNTU Hyderabad,West Bengal,Siliguri,Government,1983,B,140.0,3781,196.0,19.29,"B.Tech, B.Pharm",Not Available,88.1,5.72,9.48,59.3,39.0,18814.0,84.2,2022-23
CLG00751,National Institute of Technology Durgapur,Punjab Technical University,Puducherry,Puducherry,Autonomous,2000,A,144.0,4795,373.0,12.86,"BBA, B.Sc, B.Arch, B.Tech, BA",M.Sc,63.0,3.61,16.07,56.7,80.0,143039.0,61.7,2024-25
CLG00423,BITS Medical College,Guwahati University,Tamil Nadu,Coimbatore,Deemed,2002,A+,29.0,5378,353.0,15.24,"B.Pharm, BA","LLM, M.Arch",49.3,8.56,18.19,66.7,76.0,240499.0,97.4,2024-25
CLG00315,Indian Institute of Technology Kharagpur,University of Delhi,Chandigarh,Chandigarh,Private,2007,A,197.0,4200,227.0,18.5,"BA, LLB, BCA, B.Com","M.Arch, MCA",97.4,5.2,26.57,87.7,9.0,139370.0,74.0,2022-23
CLG01022,Bishop Cotton Law College,Banaras Hindu University,Chhattisgarh,Bhilai,Government,2004,B++,299.0,6706,387.0,17.33,"BBA, BA, LLB",MCA,57.5,4.74,14.74,76.6,13.0,86298.0,76.3,2022-23
CLG00544,BITS Institute of Engineering and Technology,University of Mumbai,Tamil Nadu,Chennai,Private,1992,A++,142.0,5043,468.0,10.78,B.Sc,Not Available,79.0,8.24,16.32,44.4,22.0,254607.0,83.0,2023-24
CLG00914,National Institute of Technology Calicut,Banaras Hindu University,Delhi,Delhi,Private,1986,B++,27.0,6207,308.0,20.15,"B.Com, B.Arch, B.Pharm, BA","M.Com, MCA, M.Tech, MBA",78.5,6.8,29.47,22.2,80.0,180039.0,77.5,2022-23
CLG00663,Miranda House National Institute of Technology,Mahatma Gandhi University,Chandigarh,Chandigarh,Private,1984,Not Accredited,203.0,3034,167.0,18.17,"LLB, B.Com","LLM, MA, MBA, M.Sc",95.6,7.55,23.53,64.4,20.0,302075.0,76.1,2022-23
CLG00903,Ram Lal Anand Institute of Information Technology,VTU,Madhya Pradesh,Bhopal,Private,2012,B++,285.0,6369,336.0,18.96,"BA, BBA",Not Available,46.2,15.39,27.78,76.4,12.0,177651.0,78.8,2022-23
CLG01672,National Institute of Technology Surathkal,Banaras Hindu University,Telangana,Warangal,Private,1976,B+,500.0,2360,153.0,15.42,"B.Com, B.Tech, B.Arch, BBA, B.Pharm","MA, M.Sc, LLM",51.6,10.97,16.67,81.4,21.0,290615.0,97.9,2023-24
CLG00686,Indian Institute of Technology Madras,Punjab Technical University,Haryana,Chandigarh,Private,1968,Not Accredited,405.0,4258,262.0,16.25,"B.Sc, BCA, B.Pharm","M.Pharm, MA, M.Arch",79.5,3.65,10.68,80.7,1.0,140439.0,74.7,2023-24
CLG00160,Indian Institute of Technology Bombay,Amity University,Jammu And Kashmir,Srinagar,Government,1967,B,81.0,1706,103.0,16.56,"LLB, BBA, B.Sc","M.Sc, M.Tech",78.0,11.7,16.69,49.3,95.0,140439.0,62.6,2023-24
CLG01000,National Institute of Technology Kurukshetra,Lovely Professional University,Goa,Panaji,Private,1977,B++,399.0,2900,166.0,17.47,BCA,"M.Sc, M.Com, MBA, MA",72.8,7.49,11.02,50.5,2.0,286660.0,100.0,2024-25
CLG01196,Christ Law College,Chandigarh University,Chhattisgarh,Bhilai,Deemed,1983,B++,239.0,2659,318.0,8.36,"BCA, B.Sc, BA, BBA",MCA,60.5,12.75,20.15,93.3,33.0,281678.0,100.0,2024-25
CLG01624,Hansraj Law College,Punjab Technical University,Kerala,Thiruvananthapuram,Government,1954,A++,484.0,1360,127.0,10.71,"B.Com, B.Tech, BCA, B.Arch",Not Available,32.8,4.81,11.55,62.7,8.0,52018.0,72.0,2024-25
CLG00203,Symbiosis Medical College,Savitribai Phule Pune University,Kerala,Kozhikode,Government,2018,B+,302.0,2429,97.0,25.04,B.Tech,Not Available,90.0,4.75,9.8,48.8,19.0,72721.0,80.1,2022-23
CLG01024,National Institute of Technology Allahabad,VTU,Puducherry,Puducherry,Private,2019,Not Accredited,247.0,3279,156.0,21.02,B.Tech,"M.Tech, M.Sc",88.0,11.12,21.29,67.6,11.0,313572.0,96.4,2022-23
CLG01400,Maharaja Institute of Information Technology,Jawaharlal Nehru University,Madhya Pradesh,Bhopal,Deemed,1957,A+,123.0,3568,388.0,9.2,B.Arch,"M.Pharm, M.Tech, MA, MCA",87.0,5.66,13.38,93.0,7.0,210461.0,60.7,2023-24
CLG01521,National Institute of Technology Rourkela,Mahatma Gandhi University,Delhi,Delhi,Private,1973,B++,463.0,4150,322.0,12.89,BCA,"MA, M.Arch, M.Sc",42.9,13.06,22.64,84.4,29.0,237389.0,78.7,2022-23
CLG00113,St. Stephen's Institute of Higher Education,JNTU Hyderabad,West Bengal,Durgapur,Autonomous,2001,C,261.0,3817,281.0,13.58,"B.Sc, B.Com, LLB, BA",M.Tech,89.6,7.19,12.66,96.5,13.0,131222.0,92.6,2023-24
CLG01653,Symbiosis Law College,Gujarat Technological University,Rajasthan,Chandigarh,Private,2021,B+,476.0,4091,178.0,22.98,"B.Arch, BBA, BA","LLM, M.Pharm, M.Tech, M.Arch",64.2,8.86,15.76,35.7,44.0,306324.0,78.7,2023-24
CLG00981,National Institute of Technology Rourkela,Savitribai Phule Pune University,Gujarat,Vadodara,Private,1962,B++,247.0,3870,175.0,22.11,B.Com,"MBA, M.Pharm",70.3,4.3,20.4,75.7,13.0,370653.0,83.2,2022-23
CLG00923,Guru Nanak Indian Institute of Technology,SRM Institute of Science and Technology,Chhattisgarh,Bhilai,Autonomous,1983,B++,74.0,3012,147.0,20.49,"B.Com, B.Sc, BBA, B.Pharm, LLB","M.Tech, MBA, M.Sc",85.5,5.13,9.84,72.7,32.0,159928.0,92.6,2023-24
CLG01418,Amrita Medical College,Chandigarh University,Madhya Pradesh,Jabalpur,Government,2022,B+,421.0,4659,210.0,22.19,"BCA, BA, LLB, B.Sc",Not Available,85.4,10.92,21.5,80.7,19.0,34644.0,91.1,2023-24
