College_ID,College_Name,University_Name,State,City,College_Type,Establishment_Year,NAAC_Grade,NIRF_Rank,Total_Students,Total_Faculty,Student_Faculty_Ratio,UG_Courses,PG_Courses,Placement_Percentage,Average_Package_LPA,Highest_Package_LPA,Internship_Percentage,Research_Publications,Annual_Fees_INR,Graduation_Rate,Academic_Year
CLG00581,National Institute of Technology Trichy,Jawaharlal Nehru University,Himachal Pradesh,Solan,Deemed,2004,A,94.0,4633,312.0,14.85,"BBA, B.Pharm, LLB, BA, B.Tech",M.Sc,66.0,4.46,26.06,71.4,28.0,87444.0,78.8,2022-23
CLG01771,Vivekananda Institute of Higher Education,Bangalore University,Tamil Nadu,Trichy,Government,1988,Not Accredited,129.0,6142,498.0,12.33,B.Sc,"MA, M.Tech, M.Arch, MBA",67.7,7.62,10.52,73.6,9.0,83262.0,98.5,2023-24
CLG01737,Bishop Cotton Institute of Pharmacy,Osmania University,Maharashtra,Mumbai,Autonomous,1996,C,103.0,5715,362.0,15.79,"BCA, B.Arch",M.Pharm,59.8,9.51,14.06,48.1,1.0,135314.0,51.6,2023-24
CLG00615,Loyola College of Engineering and Technology,SRM Institute of Science and Technology,Gujarat,Surat,Deemed,1993,B,316.0,6332,411.0,15.41,"B.Tech, B.Sc, BBA, BA","LLM, M.Pharm",67.0,9.76,13.97,74.0,85.0,171522.0,53.8,2023-24
CLG01046,National Institute of Technology Nagpur,Banaras Hindu University,Karnataka,Hubballi,Private,1969,B+,408.0,2242,98.0,22.88,B.Arch,"M.Tech, MCA, MA, MBA",60.3,5.68,19.82,68.1,27.0,139831.0,92.3,2023-24
CLG01015,National Institute of Technology Nagpur,SRM Institute of Science and Technology,Madhya Pradesh,Gwalior,Autonomous,2008,A,421.0,3198,310.0,10.32,"B.Com, LLB, BBA, B.Arch","M.Tech, LLM",62.7,11.02,32.8125,46.6,4.0,79030.0,84.2,2022-23
CLG00090,Thapar Institute of Information Technology,Aligarh Muslim University,Punjab,Chandigarh,Government,1987,A,306.0,4690,232.0,20.22,"B.Pharm, BCA","M.Arch, MBA",64.6,5.5,9.21,66.1,0.0,58959.0,82.8,2024-25
CLG01555,Lady Shri Ram Institute of Higher Education,Savitribai Phule Pune University,Odisha,Chandigarh,Private,1988,B,132.0,5101,268.0,19.03,"BBA, BA","LLM, M.Pharm, MCA",77.6,10.17,18.14,92.8,27.0,201264.0,90.5,2023-24
CLG00602,National Institute of Technology Warangal,Osmania University,Bihar,Gaya,Private,1953,Not Accredited,162.0,1667,169.0,9.86,"B.Arch, B.Com, BCA, BBA",MBA,89.3,10.95,17.96,87.6,8.0,351027.0,79.5,2023-24
CLG01238,Bhavan's College of Commerce and Economics,Lovely Professional University,Odisha,Cuttack,Autonomous,1954,B++,352.0,6017,521.0,11.55,"BBA, B.Com, LLB","M.Arch, M.Sc",31.8,5.75,9.26,77.9,10.0,101347.0,65.0,2023-24
CLG00134,National Institute of Technology Rourkela,Osmania University,Karnataka,Mangaluru,Government,1969,B,160.0,3901,276.0,14.13,B.Tech,"MCA, MBA, M.Tech",96.3,3.94,8.26,97.8,37.0,77069.0,99.5,2022-23
CLG00556,Lady Shri Ram Institute of Pharmacy,University of Delhi,Uttar Pradesh,Varanasi,Autonomous,2013,C,56.0,3237,150.0,21.58,"BBA, B.Tech, BA, B.Sc","M.Sc, M.Tech, LLM, MCA",77.2,8.6,19.22,70.8,6.0,94649.0,80.4,2022-23
CLG01032,Indian Institute of Technology Guwahati,JNTU Hyderabad,Rajasthan,Jamshedpur,Private,1997,C,8.0,3153,391.0,8.06,"B.Pharm, B.Arch, LLB, B.Sc",Not Available,69.4,6.9,14.47,70.9,66.0,503036.0,77.3,2022-23
CLG01432,Manipal Indian Institute of Technology,Sharda University,Jammu And Kashmir,Srinagar,Government,1998,B,161.0,2148,227.0,9.46,LLB,"MA, M.Com",56.9,4.58,12.81,42.6,11.0,67042.0,95.3,2023-24
CLG00321,Maharaja Polytechnic Institute,Dr. APJ Abdul Kalam Technical University,Jharkhand,Dhanbad,Private,1995,Not Accredited,406.0,5124,212.0,24.17,"B.Tech, BBA","MBA, M.Tech, MCA, MA",61.5,7.24,24.36,53.3,7.0,353837.0,79.2,2024-25
CLG01619,Maharaja Government Polytechnic College,SRM Institute of Science and Technology,Goa,Margao,Autonomous,1990,B++,484.0,2484,246.0,10.1,"B.Arch, BA, B.Sc, BBA",MBA,91.9,12.63,16.94,84.0,9.0,156373.0,74.6,2023-24
CLG01212,Ashoka National Institute of Technology,Lovely Professional University,West Bengal,Kolkata,Deemed,2024,A++,297.0,2463,109.0,22.6,"B.Com, B.Tech","LLM, M.Tech, M.Pharm",72.1,5.5,10.07,62.0,1.0,163705.0,86.3,2023-24
CLG01588,Ram Lal Anand Institute of Engineering and Technology,Chandigarh University,Assam,Dibrugarh,Deemed,1951,C,192.0,5221,257.0,20.32,"B.Com, B.Arch, B.Tech, B.Sc, BBA","LLM, M.Pharm, M.Tech",70.3,10.69,16.36,36.0,3.0,215429.0,90.7,2024-25
CLG00635,St. Stephen's Government Polytechnic College,Mahatma Gandhi University,Tamil Nadu,Madurai,Private,2007,A,337.0,3174,208.0,15.26,"B.Pharm, BCA","M.Arch, M.Com",100.0,10.49,23.59,89.5,38.0,347571.0,80.0,2023-24
CLG00553,Indian Institute of Technology Jodhpur,Jawaharlal Nehru University,Haryana,Hisar,Autonomous,1988,A+,442.0,1408,167.0,8.43,"BBA, LLB, BCA, B.Sc",Not Available,87.9,3.95,13.97,69.3,15.0,88229.0,79.5,2022-23
CLG01329,Dr. Ambedkar College of Commerce and Economics,Bharathiar University,Assam,Silchar,Autonomous,1974,A,351.0,2664,170.0,15.67,"B.Pharm, BA, BCA, B.Tech",M.Sc,74.9,11.25,31.4,46.5,1.0,109489.0,73.8,2023-24
CLG01056,"Symbiosis College of Arts, Science and Commerce",Manipal Academy of Higher Education,Rajasthan,Udaipur,Deemed,1957,B++,209.0,200,17.0,11.76,"BA, B.Sc, BCA, B.Tech",Not Available,70.3,7.98,17.11,48.4,43.0,146014.0,80.7,2024-25
CLG01525,Vellore Medical College,Kurukshetra University,Uttarakhand,Haldwani,Deemed,1996,B+,353.0,3122,311.0,10.04,"BCA, LLB, BBA, B.Arch, B.Tech","MBA, M.Sc, M.Pharm, LLM",65.7,10.29,12.5,59.3,32.0,156036.0,81.6,2023-24
CLG00797,Rajiv Gandhi Institute of Information Technology,Visvesvaraya Technological University,Andhra Pradesh,Tirupati,Deemed,1956,A,43.0,2661,146.0,18.23,"B.Pharm, B.Com, LLB, BCA","LLM, M.Com, M.Pharm, MCA",64.4,6.59,11.51,70.0,0.0,264685.0,80.3,2024-25
CLG01623,National Institute of Technology Calicut,Sharda University,Rajasthan,Srinagar,Private,1981,B+,56.0,1734,116.0,14.95,"B.Pharm, BCA, B.Tech, BBA, B.Com","M.Tech, MCA, M.Pharm, LLM",75.1,5.72,10.24,37.3,9.0,259802.0,98.2,2024-25
CLG01265,Manipal Institute of Higher Education,Calcutta University,Telangana,Warangal,Deemed,2011,C,202.0,3420,195.0,17.54,"B.Pharm, LLB, BBA, B.Sc","M.Tech, MBA, LLM",74.6,4.52,25.72,31.2,43.0,233142.0,83.0,2022-23
CLG01564,Manipal Government Polytechnic College,Lovely Professional University,Jharkhand,Ranchi,Private,2024,B++,203.0,2715,139.0,19.53,"BA, B.Arch, LLB","MCA, M.Arch",69.2,9.09,18.43,100.0,8.0,237237.0,77.8,2022-23
CLG00175,Sri Venkateswara Institute of Higher Education,Anna University,Goa,Margao,Autonomous,2022,A+,483.0,4824,430.0,11.22,"LLB, BBA, B.Sc, BA",Not Available,68.6,7.0,32.8125,56.5,44.0,177422.0,58.0,2022-23
CLG00767,National Institute of Technology Calicut,Andhra University,Bihar,Gaya,Private,1984,B,386.0,3377,176.0,19.19,BCA,M.Tech,87.8,9.94,19.27,100.0,37.0,102080.0,81.7,2024-25
CLG00246,Indian Institute of Technology Jodhpur,VIT University,Jammu And Kashmir,Jammu,Private,1975,B+,375.0,3842,192.0,20.01,LLB,"MCA, LLM, M.Arch, M.Com",100.0,8.68,18.75,93.0,1.0,315045.0,62.0,2022-23
CLG01081,Miranda House Institute of Engineering and Technology,Osmania University,Rajasthan,Jaipur,Private,1981,B,122.0,3346,150.0,22.31,"BBA, B.Pharm, B.Com","M.Arch, MBA",25.4,9.07,13.87,88.1,26.0,374240.0,91.6,2022-23
CLG01587,Indian Institute of Technology Ropar,Sharda University,Rajasthan,Kota,Private,1994,B++,234.0,5280,500.0,10.56,"B.Pharm, B.Com, B.Sc, BA, BBA","MCA, MBA, LLM, M.Tech",71.7,5.78,8.44,67.2,17.0,231980.0,100.0,2022-23
CLG00146,Jain College of Engineering,Manipal Academy of Higher Education,Bihar,Muzaffarpur,Government,1995,Not Accredited,246.0,2917,282.0,10.34,"LLB, B.Pharm, BA, BCA","M.Pharm, M.Com, M.Tech",73.1,7.97,15.65,84.0,22.0,15453.0,67.5,2024-25
CLG00091,Bishop Cotton Government Engineering College,Sharda University,Haryana,Faridabad,Autonomous,1968,C,345.0,5825,273.0,21.34,B.Com,Not Available,52.0,10.84,17.46,42.5,141.0,139120.0,94.0,2024-25
CLG00683,Presidency College of Engineering,Dr. APJ Abdul Kalam Technical University,Goa,Panaji,Private,1987,A+,13.0,2538,220.0,11.54,"B.Pharm, BA, BCA, BBA",Not Available,70.8,9.18,18.91,51.4,14.0,299144.0,77.3,2023-24
CLG00311,"Dr. Ambedkar College of Arts, Science and Commerce",Guwahati University,Odisha,Bhubaneswar,Autonomous,1968,A,313.0,3236,261.0,12.4,"B.Arch, B.Com, BCA","MCA, M.Pharm",82.0,7.79,24.64,61.1,97.0,116790.0,86.1,2023-24
CLG00094,National Institute of Technology Nagpur,Ranchi University,Karnataka,Mangaluru,Private,1958,B+,146.0,4375,188.0,23.27,"B.Com, BCA",Not Available,79.8,11.24,18.03,49.0,9.0,246687.0,100.0,2022-23
CLG01434,Indian Institute of Technology Bombay,Calcutta University,Karnataka,Hubballi,Private,1950,C,156.0,3657,162.0,22.57,"B.Tech, B.Com, BBA, BCA, B.Sc","M.Sc, MCA",79.0,10.9,20.79,52.4,4.0,119400.0,50.0,2024-25
CLG00925,Ram Lal Anand Institute of Information Technology,Osmania University,Himachal Pradesh,Shimla,Government,2007,B+,257.0,969,61.0,15.89,B.Pharm,Not Available,85.0,10.4,19.9,100.0,96.0,64412.0,86.6,2022-23
CLG01545,Vivekananda Institute of Engineering and Technology,Guwahati University,Gujarat,Ahmedabad,Autonomous,1958,B,147.0,5022,204.0,24.62,"B.Com, B.Arch, BA, LLB",Not Available,67.8,7.58,10.81,72.8,13.0,80413.0,72.5,2024-25
CLG01036,Netaji Subhas Institute of Pharmacy,VTU,Karnataka,Mysuru,Private,2004,A,200.0,4028,458.0,8.79,"B.Arch, B.Com",M.Pharm,96.3,7.51,10.52,88.1,32.0,385761.0,78.3,2023-24
CLG00244,Hansraj Institute of Information Technology,Jawaharlal Nehru University,West Bengal,Siliguri,Autonomous,1950,C,419.0,1965,187.0,10.51,"B.Arch, B.Sc, B.Tech, B.Com, B.Pharm","M.Tech, M.Arch, MA, MBA",51.5,5.62,17.45,42.0,56.0,33709.0,71.9,2024-25
CLG01112,Sri Venkateswara Institute of Information Technology,Punjab Technical University,Madhya Pradesh,Indore,Private,2022,B,29.0,5237,580.0,9.03,"LLB, B.Arch, B.Sc, BA",MA,92.0,10.7,17.49,68.9,5.0,406767.0,89.0,2022-23
CLG00215,Jain Institute of Applied Sciences,University of Delhi,Assam,Silchar,Government,2005,C,245.0,3255,137.0,23.76,"B.Com, LLB","MCA, M.Arch, MA, MBA",56.6,5.78,12.73,27.1,2.0,66398.0,97.5,2024-25
CLG01198,Fergusson College of Engineering,Aligarh Muslim University,Telangana,Hyderabad,Private,1978,B+,145.0,2509,145.0,17.3,"LLB, B.Sc, B.Pharm",Not Available,74.3,7.21,10.09,54.5,8.0,194157.0,73.7,2023-24
CLG00999,"Ram Lal Anand College of Arts, Science and Commerce",Osmania University,Madhya Pradesh,Gwalior,Autonomous,1985,A,467.0,5244,270.0,19.42,"BBA, LLB, BA",Not Available,59.8,6.22,11.28,71.6,10.0,16756.0,94.7,2024-25
CLG00854,Indian Institute of Technology Hyderabad,Dr. APJ Abdul Kalam Technical University,Delhi,Delhi,Government,1983,A+,147.0,200,10.0,20.0,"B.Com, B.Arch, B.Sc, BCA",Not Available,67.5,4.83,12.81,56.7,29.0,105058.0,91.0,2023-24
CLG00426,Indian Institute of Technology Kharagpur,Bharathiar University,Maharashtra,Nagpur,Autonomous,1977,A,376.0,383,23.0,16.65,LLB,Not Available,64.2,13.7,23.41,65.4,28.0,143631.0,78.8,2023-24
CLG01611,Dr. Ambedkar School of Business Management,Sharda University,Punjab,Chandigarh,Government,1975,A+,286.0,3488,421.0,8.29,B.Tech,"M.Arch, M.Sc, LLM",48.4,3.8,16.83,82.6,24.0,33029.0,69.4,2024-25
CLG01143,Indian Institute of Technology Kharagpur,Utkal University,Madhya Pradesh,Indore,Government,1997,A+,422.0,4185,218.0,19.2,"LLB, B.Tech, B.Arch, BCA, BA",Not Available,70.3,16.33,20.16,100.0,20.0,49017.0,94.8,2024-25
CLG01144,Jain Law College,Anna University,Puducherry,Puducherry,Government,1980,B,38.0,5867,717.0,8.18,"B.Com, B.Pharm, LLB, B.Sc, B.Arch",M.Arch,85.8,12.35,17.64,100.0,0.0,121820.0,96.4,2022-23
CLG00227,Ram Lal Anand Government Polytechnic College,Aligarh Muslim University,Jammu And Kashmir,Jammu,Private,1986,B,222.0,4611,318.0,14.5,B.Pharm,M.Com,60.8,6.87,10.61,100.0,0.0,328460.0,86.5,2024-25
CLG01489,Fergusson Institute of Applied Sciences,Bharathiar University,West Bengal,Kolkata,Deemed,1973,B,205.0,2411,110.0,21.92,LLB,"MBA, MCA, M.Com, M.Tech",100.0,5.09,7.74,60.9,10.0,246562.0,75.7,2022-23
CLG00001,Loyola Institute of Engineering and Technology,Calcutta University,Andhra Pradesh,Visakhapatnam,Deemed,2019,A+,214.0,4245,497.0,8.54,BA,"M.Tech, MA, MCA, M.Arch",67.5,9.58,28.61,66.1,0.0,261394.0,73.0,2024-25
CLG00402,Netaji Subhas Institute of Pharmacy,Gujarat Technological University,Rajasthan,Hyderabad,Deemed,1986,A,26.0,843,40.0,21.08,"B.Arch, B.Sc, BA, B.Com, B.Pharm","M.Sc, M.Tech, M.Arch",78.5,3.74,6.86,23.5,3.0,193114.0,67.3,2022-23
CLG01104,DAV School of Business Management,Utkal University,Andhra Pradesh,Vijayawada,Private,1969,B+,86.0,3677,166.0,22.15,"B.Com, B.Tech, BA","MBA, M.Tech",49.6,11.16,32.8125,62.4,6.0,194262.0,100.0,2024-25
CLG00085,Rajiv Gandhi Government Polytechnic College,Aligarh Muslim University,Andhra Pradesh,Vijayawada,Government,1980,B++,404.0,2409,129.0,18.67,B.Sc,"LLM, M.Tech, MCA",65.5,7.29,18.7,72.6,49.0,78317.0,95.4,2024-25
CLG00163,Lady Shri Ram Institute of Engineering and Technology,Osmania University,Jharkhand,Jamshedpur,Government,1956,A,409.0,4934,294.0,16.78,B.Arch,Not Available,58.8,10.24,14.51,64.9,12.0,80891.0,91.5,2023-24
CLG00115,Ashoka Institute of Management Studies,Dr. APJ Abdul Kalam Technical University,Uttar Pradesh,Varanasi,Deemed,1997,B++,279.0,1619,68.0,23.81,"BA, LLB, BCA, BBA, B.Tech","MCA, M.Sc, MBA, M.Tech",94.8,10.05,20.61,70.2,8.0,197955.0,94.1,2022-23
CLG00671,Rajiv Gandhi National Institute of Technology,Guwahati University,Rajasthan,Jaipur,Government,2012,B++,23.0,4981,215.0,23.17,"BBA, B.Arch, B.Com",Not Available,56.4,5.29,11.32,53.3,18.0,88764.0,93.5,2024-25
CLG01175,Lady Shri Ram School of Business Management,Banaras Hindu University,Madhya Pradesh,Jabalpur,Government,1991,B++,292.0,2191,119.0,18.41,"BBA, LLB, B.Arch","M.Com, M.Tech, M.Pharm",46.4,8.79,11.55,61.4,50.0,33553.0,76.4,2022-23
CLG01415,Shiv Nadar College of Commerce and Economics,Savitribai Phule Pune University,Rajasthan,Jodhpur,Private,1957,A,137.0,3299,272.0,12.13,"B.Arch, LLB, BBA",MCA,60.6,5.62,16.28,89.7,5.0,89603.0,76.4,2022-23
CLG00890,Presidency College of Commerce and Economics,JNTU Hyderabad,Kerala,Kozhikode,Deemed,2017,B+,202.0,4699,374.0,12.56,"B.Sc, B.Com","MBA, M.Com, LLM, M.Arch",80.6,4.8,15.86,72.7,41.0,169118.0,69.0,2024-25
CLG00626,Jain College of Commerce and Economics,Chandigarh University,Madhya Pradesh,Gwalior,Government,2021,A,148.0,1597,159.0,10.04,"B.Sc, B.Tech, B.Pharm","M.Pharm, M.Arch",71.7,5.07,16.85,35.0,204.0,15636.0,100.0,2024-25
CLG01788,DAV Institute of Management and Research,Utkal University,Puducherry,Puducherry,Private,1954,B++,232.0,2911,246.0,11.83,"B.Pharm, B.Arch, BA",Not Available,68.9,8.06,13.25,24.8,8.0,257477.0,63.4,2023-24
CLG00953,National Institute of Technology Trichy,Guwahati University,Madhya Pradesh,Jabalpur,Deemed,1967,A+,308.0,2017,95.0,21.23,B.Sc,"M.Sc, M.Com, LLM",67.4,6.95,15.62,69.8,11.0,103140.0,83.4,2022-23
CLG00808,Indian Institute of Technology Delhi,Ranchi University,Odisha,Chandigarh,Deemed,2005,A++,266.0,3451,148.0,23.32,"LLB, B.Sc, BA","M.Arch, LLM",86.0,11.13,21.06,68.4,6.0,139560.0,78.8,2022-23
CLG00625,Ram Lal Anand Institute of Management Studies,Visvesvaraya Technological University,Himachal Pradesh,Shimla,Autonomous,2008,A++,59.0,2519,166.0,15.17,"B.Pharm, B.Sc, LLB, B.Tech, BA",Not Available,63.0,5.87,14.67,90.4,24.0,70996.0,89.4,2022-23
CLG00827,National Institute of Technology Srinagar,VTU,Andhra Pradesh,Vijayawada,Private,2016,A+,444.0,3811,398.0,9.58,B.Com,"M.Arch, M.Com, M.Sc",52.4,14.16,20.44,73.9,49.0,354005.0,67.8,2022-23
CLG00235,National Institute of Technology Calicut,Lovely Professional University,Andhra Pradesh,Visakhapatnam,Private,2016,Not Accredited,182.0,1102,75.0,14.69,"B.Tech, LLB, BCA, B.Com","MBA, LLM, M.Pharm, M.Arch",78.3,15.6,18.41,73.5,42.0,251914.0,79.0,2024-25
CLG00136,Indian Institute of Technology Indore,Visvesvaraya Technological University,Uttar Pradesh,Lucknow,Government,1985,B++,245.0,4552,213.0,21.37,"BBA, BA, BCA","MA, M.Pharm, M.Tech, M.Sc",88.6,7.82,9.58,72.5,33.0,110177.0,85.0,2023-24
CLG00617,National Institute of Technology Calicut,Andhra University,Himachal Pradesh,Mandi,Government,1989,B+,162.0,1061,47.0,22.57,"B.Pharm, LLB",Not Available,24.9,8.4,16.81,100.0,5.0,52254.0,84.5,2022-23
CLG01789,Rajiv Gandhi School of Business Management,Rajasthan Technical University,Chhattisgarh,Bilaspur,Private,1961,C,247.0,3151,264.0,11.94,"B.Com, BBA, B.Sc","M.Com, LLM, M.Tech",74.4,6.27,32.8125,77.2,40.0,282124.0,71.1,2023-24
CLG00837,Indian Institute of Technology Kharagpur,JNTU Hyderabad,Madhya Pradesh,Indore,Private,1969,B++,288.0,2732,221.0,12.36,"B.Tech, B.Sc",Not Available,92.9,5.52,8.82,79.5,25.0,525602.0,69.2,2023-24
CLG00843,Christ Institute of Management Studies,Aligarh Muslim University,Haryana,Kurukshetra,Private,1961,A++,455.0,880,66.0,13.33,B.Tech,Not Available,63.1,6.18,17.51,66.1,0.0,232535.0,96.3,2022-23
CLG00960,St. Stephen's National Institute of Technology,Calcutta University,Maharashtra,Chandigarh,Government,1996,Not Accredited,205.0,3092,127.0,24.35,"B.Pharm, BCA, BA, B.Com, BBA",Not Available,47.0,8.65,9.93,68.0,16.0,10000.0,71.2,2023-24
CLG00593,Sardar Patel Polytechnic Institute,Anna University,Chhattisgarh,Raipur,Autonomous,2003,A+,69.0,3547,192.0,18.47,"BA, BCA, B.Sc","MBA, M.Tech, M.Arch, MA",82.4,11.25,23.16,64.9,5.0,93345.0,74.3,2022-23
CLG01315,Bishop Cotton Institute of Information Technology,Mahatma Gandhi University,Delhi,Delhi,Deemed,1977,A,294.0,3261,397.0,8.21,"B.Sc, B.Pharm, BBA, BA","M.Pharm, M.Com, M.Arch, LLM",100.0,7.04,18.98,49.8,76.0,209526.0,51.7,2023-24
CLG01292,BITS Indian Institute of Technology,Osmania University,Rajasthan,Patna,Private,1961,B++,412.0,5164,538.0,9.6,"B.Tech, BCA, BBA, BA","M.Com, LLM",68.8,4.62,13.27,82.1,20.0,196284.0,83.1,2023-24
CLG00344,National Institute of Technology Surathkal,Savitribai Phule Pune University,Goa,Panaji,Government,1964,C,232.0,4300,284.0,15.14,"BA, BBA, B.Pharm","M.Com, MA, M.Tech, M.Pharm",64.3,7.44,10.96,100.0,5.0,90223.0,64.9,2024-25
CLG01510,Indian Institute of Technology Kharagpur,Ranchi University,Chhattisgarh,Bilaspur,Private,1992,A+,410.0,4862,264.0,18.42,"B.Tech, BBA","MCA, M.Com, M.Arch, LLM",76.0,6.48,11.12,73.0,65.0,65791.0,61.0,2023-24
CLG01562,"Vivekananda College of Arts, Science and Commerce",Lovely Professional University,Goa,Margao,Government,2009,A++,309.0,4152,188.0,22.09,B.Tech,Not Available,31.1,6.22,20.7,87.9,18.0,90818.0,76.5,2023-24
CLG00294,"Miranda House College of Arts, Science and Commerce",Guwahati University,West Bengal,Siliguri,Government,1956,B,460.0,1804,173.0,10.43,"B.Sc, LLB, B.Pharm, BBA","M.Com, M.Arch, MA, LLM",81.2,9.51,13.83,70.1,108.0,84610.0,94.3,2023-24
CLG00365,National Institute of Technology Rourkela,JNTU Hyderabad,Chhattisgarh,Chandigarh,Private,2017,C,362.0,835,48.0,17.4,B.Arch,Not Available,89.2,8.26,25.94,74.3,16.0,140439.0,80.6,2022-23
CLG00179,Presidency Medical College,Manipal Academy of Higher Education,West Bengal,Chandigarh,Autonomous,1961,C,341.0,3219,170.0,18.94,"B.Pharm, B.Tech, B.Com",Not Available,87.7,11.66,20.38,57.9,58.0,128423.0,95.8,2023-24
CLG00660,Sri Venkateswara College of Commerce and Economics,Ranchi University,Himachal Pradesh,Mandi,Deemed,1954,Not Accredited,297.0,2489,170.0,14.64,"BA, B.Arch, B.Com, BCA, B.Pharm","LLM, MBA, M.Tech, M.Pharm",87.2,2.81,9.73,59.0,1.0,171340.0,62.3,2022-23
CLG00997,KIIT Government Engineering College,Dr. APJ Abdul Kalam Technical University,Haryana,Gurugram,Private,1957,C,32.0,2634,143.0,18.42,"BA, B.Tech, B.Com, B.Arch",M.Tech,75.3,8.05,13.88,71.2,0.0,392395.0,97.0,2023-24
CLG00015,Ramaiah College of Engineering and Technology,Osmania University,Jammu And Kashmir,Srinagar,Private,2022,A,302.0,1906,219.0,8.7,B.Arch,"LLM, MCA, M.Com, M.Sc",78.5,5.26,24.56,49.3,77.0,217793.0,75.7,2024-25
CLG01111,Indian Institute of Technology Guwahati,Punjab Technical University,Chhattisgarh,Bhilai,Government,2000,A,47.0,6141,761.0,8.07,BCA,"MA, LLM",67.7,3.59,8.23,56.1,12.0,52278.0,70.2,2024-25
CLG01395,Symbiosis School of Business Management,Punjab Technical University,Assam,Guwahati,Private,1995,A++,75.0,8061,919.0,8.77,B.Tech,MA,52.6,11.5,22.15,53.3,34.0,457595.0,77.2,2022-23
CLG00166,National Institute of Technology Warangal,Mahatma Gandhi University,Assam,Dibrugarh,Deemed,1997,B++,380.0,2766,292.0,9.47,LLB,"M.Sc, M.Tech, MA",49.8,7.91,13.45,33.1,55.0,241088.0,73.6,2024-25
CLG01717,"Hansraj College of Arts, Science and Commerce",Punjab Technical University,Jharkhand,Dhanbad,Autonomous,2011,Not Accredited,278.0,3110,137.0,22.7,"B.Com, B.Sc, B.Arch, LLB, BA","LLM, MBA",43.0,6.63,19.35,100.0,59.0,183667.0,100.0,2023-24
CLG01360,Sardar Patel Institute of Technology and Science,Mahatma Gandhi University,Punjab,Amritsar,Government,1986,B++,166.0,4321,261.0,16.56,"BA, B.Tech, LLB, B.Pharm","M.Com, MBA, M.Pharm, MA",49.7,11.99,21.18,68.0,46.0,45454.0,73.4,2024-25
CLG00060,National Institute of Technology Jamshedpur,Calcutta University,Haryana,Gurugram,Autonomous,1997,B+,247.0,4640,244.0,19.02,B.Arch,Not Available,89.9,10.03,11.35,49.1,79.0,138557.0,72.8,2023-24
CLG00710,Loyola Indian Institute of Technology,Chandigarh University,Madhya Pradesh,Jabalpur,Autonomous,1962,B++,482.0,1116,84.0,13.29,B.Arch,"MA, M.Sc",36.3,8.05,12.65,46.5,20.0,139287.0,88.4,2024-25
CLG00677,National Institute of Technology Nagpur,Guwahati University,Jharkhand,Jamshedpur,Private,1992,B+,241.0,4733,198.0,23.9,BCA,"M.Pharm, M.Com",69.8,6.57,32.59,34.1,16.0,339835.0,93.5,2023-24
CLG01379,National Institute of Technology Patna,Ranchi University,Chandigarh,Chandigarh,Autonomous,1950,Not Accredited,499.0,2170,99.0,21.92,"LLB, B.Tech, BCA, B.Com",Not Available,55.3,6.56,12.61,78.4,28.0,44604.0,75.0,2023-24
CLG00781,Dr. Ambedkar College of Engineering and Technology,Banaras Hindu University,Karnataka,Hubballi,Private,1974,B,139.0,5267,262.0,20.1,"B.Tech, B.Pharm, B.Sc",Not Available,77.3,4.42,9.93,100.0,20.0,389543.0,76.7,2023-24
CLG00425,Christ College of Engineering,Lovely Professional University,Tamil Nadu,Trichy,Government,1997,B+,18.0,4260,252.0,16.9,BCA,"MBA, LLM",67.7,5.45,7.65,55.6,12.0,10000.0,80.3,2023-24
CLG00293,Lady Shri Ram Law College,Savitribai Phule Pune University,Assam,Guwahati,Private,1955,C,123.0,4308,256.0,16.83,"B.Tech, B.Arch, BBA, BCA",MBA,72.7,10.0,15.54,62.0,16.0,269502.0,70.9,2023-24
CLG01066,Lady Shri Ram Polytechnic Institute,Andhra University,Uttar Pradesh,Kanpur,Government,1977,Not Accredited,76.0,3666,352.0,10.41,"LLB, B.Tech","MBA, LLM, M.Sc, M.Com",100.0,9.38,22.36,64.3,8.0,26098.0,89.9,2024-25
CLG01639,Vellore College of Commerce and Economics,Bangalore University,Tamil Nadu,Coimbatore,Deemed,1998,Not Accredited,344.0,5484,301.0,18.22,"B.Pharm, B.Arch, BBA",MBA,54.2,6.98,15.82,59.8,20.0,118588.0,85.1,2022-23
CLG00330,BITS College of Engineering and Technology,Sharda University,Rajasthan,Durgapur,Private,1968,B+,218.0,1731,147.0,11.78,B.Pharm,Not Available,94.2,6.25,26.58,86.4,3.0,120685.0,86.9,2022-23
CLG00430,Thapar Institute of Management and Research,Anna University,Assam,Dibrugarh,Private,1961,A+,48.0,2285,132.0,17.31,"B.Com, LLB, B.Pharm",MBA,87.2,9.12,15.71,69.1,23.0,326587.0,70.8,2023-24
CLG01013,Jain Institute of Management and Research,Banaras Hindu University,West Bengal,Kolkata,Government,2011,A,298.0,3763,406.0,9.27,BBA,"MBA, M.Com",51.6,14.7,32.8125,56.9,18.0,84874.0,66.7,2022-23
CLG00080,Kirori Mal National Institute of Technology,SRM Institute of Science and Technology,Chandigarh,Chandigarh,Private,1969,A+,423.0,3651,184.0,19.84,"B.Com, B.Pharm, B.Tech, BA, LLB",M.Pharm,40.7,9.24,23.76,74.5,0.0,275602.0,91.8,2024-25
CLG01053,Rajiv Gandhi Medical College,Dr. APJ Abdul Kalam Technical University,Gujarat,Rajkot,Private,2014,B++,411.0,3094,340.0,9.1,"BBA, B.Com",Not Available,99.0,10.69,18.14,87.8,10.0,360027.0,99.0,2023-24
CLG00938,Symbiosis Government Engineering College,Utkal University,Punjab,Chandigarh,Government,1950,C,19.0,5479,514.0,10.66,"BCA, BA, BBA",M.Sc,91.5,6.68,23.17,88.8,11.0,74899.0,87.6,2022-23
CLG00835,Hindu National Institute of Technology,Anna University,Assam,Guwahati,Private,1997,A++,204.0,2190,160.0,13.69,"B.Pharm, BCA, BBA, B.Com, LLB","M.Sc, M.Pharm, M.Arch, MA",66.0,6.63,11.47,58.5,33.0,286022.0,86.5,2023-24
CLG00750,Bhavan's Institute of Engineering and Technology,JNTU Hyderabad,Chandigarh,Chandigarh,Government,1951,B+,200.0,1764,202.0,8.73,"B.Com, BA, B.Tech, BCA",M.Pharm,75.8,4.44,9.72,97.1,2.0,96718.0,77.1,2022-23
CLG00891,Miranda House Institute of Management and Research,Amity University,Rajasthan,Kolkata,Government,2003,B,64.0,3874,271.0,14.3,"B.Arch, BA, B.Tech, B.Com, BCA",Not Available,26.1,6.99,13.65,81.2,98.0,66921.0,91.9,2022-23
CLG00255,Jain College of Commerce and Economics,Manipal Academy of Higher Education,Odisha,Cuttack,Government,2022,A++,247.0,2960,149.0,19.87,BA,"M.Sc, M.Pharm, MCA",46.1,6.4,15.5,71.9,2.0,58540.0,64.1,2023-24
CLG01585,National Institute of Technology Calicut,Bharathiar University,Puducherry,Puducherry,Private,2013,C,133.0,3940,158.0,24.94,"B.Sc, B.Tech, B.Com","M.Tech, MBA, MCA, MA",70.3,10.17,13.61,71.4,37.0,334633.0,82.5,2024-25
CLG01787,Indian Institute of Technology Delhi,Calcutta University,West Bengal,Kolkata,Private,1997,B,420.0,2102,108.0,19.46,"BCA, B.Sc, LLB",Not Available,91.8,10.13,25.98,79.2,9.0,387697.0,70.4,2022-23
CLG01338,Amrita Law College,Osmania University,Himachal Pradesh,Solan,Autonomous,1962,A,388.0,4524,345.0,13.11,"B.Pharm, B.Arch, BCA","MBA, MA, MCA, M.Pharm",72.0,7.56,14.56,62.0,1.0,44050.0,52.0,2023-24
CLG01109,National Institute of Technology Calicut,Osmania University,Maharashtra,Nagpur,Government,1982,B+,405.0,3286,133.0,24.71,"B.Pharm, B.Sc, B.Tech","M.Pharm, M.Com, M.Arch, MA",86.6,6.24,8.88,89.8,0.0,52299.0,85.8,2024-25
CLG00137,Indian Institute of Technology Bhubaneswar,Chandigarh University,Punjab,Patiala,Private,1967,A,306.0,2442,101.0,24.18,"B.Pharm, BCA","MCA, MBA, LLM",69.0,9.26,17.33,68.4,3.0,108628.0,99.0,2024-25
CLG01136,National Institute of Technology Patna,Jawaharlal Nehru University,Tamil Nadu,Chennai,Private,2011,A,140.0,4419,193.0,22.9,"B.Sc, B.Pharm, BA, BCA",M.Arch,70.3,12.02,18.24,68.8,1.0,367770.0,59.9,2024-25
